{
  "schema_version": "cad_ir_v0.1",
  "sample_id": "102525_06a3094b_0000",
  "unit": "mm",
  "coordinate_system": {
    "up_axis": "z",
    "front_axis": "y",
    "right_axis": "x"
  },
  "operations": [
    {
      "op_id": "sk_44a24774",
      "op_type": "sketch_polygon",
      "role": "base_profile",
      "plane": "XY",
      "params": {
        "vertices": [
          [
            1.95,
            2.45
          ],
          [
            -1.95,
            2.45
          ],
          [
            -1.95,
            -2.45
          ],
          [
            1.95,
            -2.45
          ]
        ]
      }
    },
    {
      "op_id": "ft_44ba150a",
      "op_type": "extrude",
      "role": "base_body",
      "input": "sk_44a24774",
      "params": {
        "distance": 1.55,
        "extent_type": "one_side",
        "operation": "new_body",
        "direction": "+normal",
        "taper_angle": 0
      }
    },
    {
      "op_id": "op_export_step",
      "op_type": "export_step",
      "role": "export",
      "input": "ft_44ba150a",
      "params": {
        "path": "102525_06a3094b_0000.step"
      }
    }
  ],
  "metadata": {
    "compiler": "history2ir_v0.1",
    "source": "history_json"
  }
}