{
  "schema_version": "cad_ir_v0.1",
  "sample_id": "101817_b02acd9f_0001",
  "unit": "mm",
  "coordinate_system": {
    "up_axis": "z",
    "front_axis": "y",
    "right_axis": "x"
  },
  "operations": [
    {
      "op_id": "sk_85cec1ba",
      "op_type": "sketch_annulus",
      "role": "base_profile",
      "plane": "XY",
      "params": {
        "inner_radius": 0.0,
        "outer_radius": 0.0,
        "center": [
          0.0,
          0.0
        ]
      }
    },
    {
      "op_id": "ft_85d29240",
      "op_type": "extrude",
      "role": "base_body",
      "input": "sk_85cec1ba",
      "params": {
        "distance": 520.0,
        "extent_type": "one_side",
        "operation": "new_body",
        "direction": "+normal",
        "taper_angle": 0
      }
    },
    {
      "op_id": "op_export_step",
      "op_type": "export_step",
      "role": "export",
      "input": "ft_85d29240",
      "params": {
        "path": "101817_b02acd9f_0001.step"
      }
    }
  ],
  "metadata": {
    "compiler": "history2ir_v0.1",
    "source": "history_json"
  }
}