{
  "schema_version": "cad_ir_v0.1",
  "sample_id": "100243_9fb796fe_0006",
  "unit": "mm",
  "coordinate_system": {
    "up_axis": "z",
    "front_axis": "y",
    "right_axis": "x"
  },
  "operations": [
    {
      "op_id": "op_001",
      "op_type": "sketch_rectangle",
      "role": "base_profile",
      "plane": "XY",
      "params": {
        "width": 19.0,
        "height": 19.0,
        "center": [
          5.0,
          5.0
        ]
      }
    },
    {
      "op_id": "op_002",
      "op_type": "extrude",
      "role": "base_body",
      "input": "op_001",
      "params": {
        "distance": 130.0,
        "extent_type": "one_side",
        "operation": "new_body",
        "direction": "+normal"
      }
    },
    {
      "op_id": "op_003",
      "op_type": "export_step",
      "input": "op_002",
      "params": {
        "path": "D:\\PythonProgramming\\CAD Generation\\Constraint-grounded agentic CAD generation\\子课题1-Solver-Kernel双反馈闭环驱动的CAD生成质量提升研究\\cad_repair_loop\\results\\100243_9fb796fe_0006\\iter_02\\100243_9fb796fe_0006.step"
      }
    }
  ],
  "metadata": {
    "source": "manual_from_clean_sample",
    "profile_type": "rectangle"
  }
}