{
  "coordinate_system": {
    "front_axis": "y",
    "right_axis": "x",
    "up_axis": "z"
  },
  "metadata": {
    "comments": "Fixed extrude distance from 18.0 to 12.0 to match design plan explicit dimension and bbox validation intents.",
    "source": "repair"
  },
  "operations": [
    {
      "op_id": "sk_16e99af6",
      "op_type": "sketch_annulus",
      "params": {
        "center": [
          0.0,
          0.0
        ],
        "inner_radius": 4.25,
        "outer_radius": 6.0
      },
      "plane": "XY",
      "role": "base_profile"
    },
    {
      "input": "sk_16e99af6",
      "op_id": "ft_170b2a7a",
      "op_type": "extrude",
      "params": {
        "direction": "+normal",
        "distance": 12.0,
        "extent_type": "one_side",
        "operation": "new_body",
        "taper_angle": 0
      },
      "role": "base_body"
    },
    {
      "input": "ft_170b2a7a",
      "op_id": "op_export_step",
      "op_type": "export_step",
      "params": {
        "path": "102410_f9877a7b_0012.step"
      },
      "role": "export"
    }
  ],
  "sample_id": "102410_f9877a7b_0012",
  "schema_version": "cad_ir_v0.1",
  "unit": "mm"
}