{
  "schema_version": "cad_ir_v0.1",
  "sample_id": "101427_a9bcb09c_0002",
  "unit": "mm",
  "coordinate_system": {
    "up_axis": "z",
    "front_axis": "y",
    "right_axis": "x"
  },
  "operations": [
    {
      "op_id": "sk_35f23fdc",
      "op_type": "sketch_polygon",
      "role": "base_profile",
      "plane": "XY",
      "params": {
        "vertices": [
          [
            0.0,
            0.0
          ],
          [
            1930.0,
            0.0
          ],
          [
            1930.0,
            550.0
          ],
          [
            0.0,
            550.0
          ]
        ]
      }
    },
    {
      "op_id": "ft_35f4fef6",
      "op_type": "extrude",
      "role": "base_body",
      "input": "sk_35f23fdc",
      "params": {
        "distance": 50.0,
        "extent_type": "one_side",
        "operation": "new_body",
        "direction": "+normal",
        "taper_angle": 0
      }
    },
    {
      "op_id": "op_export_step",
      "op_type": "export_step",
      "role": "export",
      "input": "ft_35f4fef6",
      "params": {
        "path": "101427_a9bcb09c_0002.step"
      }
    }
  ],
  "metadata": {
    "compiler": "history2ir_v0.1",
    "source": "history_json"
  }
}