{
  "coordinate_system": {
    "front_axis": "y",
    "right_axis": "x",
    "up_axis": "z"
  },
  "metadata": {
    "comments": "IR parameters match design plan and KQP passed; STEP export failure is likely a transient pipeline issue. No geometric changes needed.",
    "source": "repair"
  },
  "operations": [
    {
      "op_id": "op_001",
      "op_type": "sketch_rectangle",
      "params": {
        "center": [
          127.0,
          95.25
        ],
        "height": 190.5,
        "width": 254.0
      },
      "plane": "XY",
      "role": "base_profile"
    },
    {
      "input": "op_001",
      "op_id": "op_002",
      "op_type": "extrude",
      "params": {
        "direction": "+normal",
        "distance": 3.175,
        "extent_type": "one_side",
        "operation": "new_body",
        "taper_angle": 0
      },
      "role": "base_body"
    },
    {
      "input": "op_002",
      "op_id": "op_003",
      "op_type": "export_step",
      "params": {
        "path": "100877_ac1e5a17_0017.step"
      },
      "role": "export"
    }
  ],
  "sample_id": "100877_ac1e5a17_0017",
  "schema_version": "cad_ir_v0.1",
  "unit": "mm"
}