{
  "schema_version": "cad_ir_v0.1",
  "sample_id": "104453_aba0f2d1_0006",
  "unit": "mm",
  "coordinate_system": {
    "up_axis": "z",
    "front_axis": "y",
    "right_axis": "x"
  },
  "operations": [
    {
      "op_id": "op_001",
      "op_type": "sketch_rectangular_frame",
      "role": "base_profile",
      "plane": "XY",
      "params": {
        "outer_width": 500.0,
        "outer_height": 300.0,
        "inner_width": 400.0,
        "inner_height": 200.0,
        "center": [
          5.0,
          5.0
        ]
      }
    },
    {
      "op_id": "op_002",
      "op_type": "extrude",
      "role": "base_body",
      "input": "op_001",
      "params": {
        "distance": 500.0,
        "extent_type": "one_side",
        "operation": "new_body",
        "direction": "+normal"
      }
    },
    {
      "op_id": "op_003",
      "op_type": "export_step",
      "input": "op_002",
      "params": {
        "path": "104453_aba0f2d1_0006.step"
      }
    }
  ],
  "metadata": {
    "source": "manual_from_clean_sample",
    "profile_type": "rectangular_frame"
  }
}